{
  "id": "q.air.201",
  "tribe": "Air",
  "tier": 3,
  "kind": "dialogue",
  "ageBuckets": ["18-35", "36-60", "61-102"],
  "localizationKey": "reinmaker.quests.air_201",
  "estimatedDurationMin": 7,
  "steps": [
    {
      "type": "dialogue",
      "npc": "Navigator Breeze",
      "cue": "air.mastery.intro",
      "emotion": "encouraging",
      "text": "Guide a facilitator through tension in their learner circle." 
    },
    {
      "type": "empathy",
      "npc": "Facilitator Amara",
      "branches": [
        {
          "prompt": "Two learners disagree strongly.",
          "responses": [
            { "text": "Name the feelings and invite slow breathing", "impact": "positive" },
            { "text": "Pick a side immediately", "impact": "growth" }
          ]
        }
      ]
    }
  ],
  "successCriteria": {
    "scoreMin": 0.82,
    "timeMaxSec": 420
  },
  "rewards": {
    "xp": 56,
    "cosmetics": ["badge.air.mastery"],
    "stoneId": "air.mastery"
  },
  "captions": {
    "en": "captions/q.air.201.en.vtt"
  }
}


