{
  "id": "q.stone.201",
  "tribe": "Stone",
  "tier": 3,
  "kind": "dialogue",
  "ageBuckets": ["18-35", "36-60", "61-102"],
  "localizationKey": "reinmaker.quests.stone_201",
  "estimatedDurationMin": 7,
  "steps": [
    {
      "type": "dialogue",
      "npc": "Architect Rune",
      "cue": "stone.mastery.intro",
      "emotion": "focused",
      "text": "Mentor a builder learning to balance patience with boldness." 
    },
    {
      "type": "empathy",
      "npc": "Apprentice Milo",
      "branches": [
        {
          "prompt": "Milo keeps rebuilding the same wall.",
          "responses": [
            { "text": "Reflect on the pattern and invite a new plan", "impact": "positive" },
            { "text": "Tell him to build faster", "impact": "growth" }
          ]
        }
      ]
    }
  ],
  "successCriteria": {
    "scoreMin": 0.8,
    "timeMaxSec": 420
  },
  "rewards": {
    "xp": 55,
    "cosmetics": ["badge.stone.mastery"],
    "stoneId": "stone.mastery"
  },
  "captions": {
    "en": "captions/q.stone.201.en.vtt"
  }
}





















